{
  "id": "level-003",
  "name": "Verzamel de Sterren",
  "difficulty": 3,
  "description": "Gebruik het repeat-commando om alle sterren op te pakken en het doel te bereiken. Let op: je mag maar 5 commando's gebruiken!",
  "concept": "herhaling",
  "grid": {
    "width": 6,
    "height": 3,
    "start": { "x": 0, "y": 1, "direction": "east" },
    "goal": { "x": 5, "y": 1 },
    "walls": [
      { "x": 1, "y": 0 },
      { "x": 1, "y": 2 },
      { "x": 3, "y": 0 },
      { "x": 3, "y": 2 }
    ],
    "collectibles": [
      { "x": 1, "y": 1 },
      { "x": 3, "y": 1 }
    ]
  },
  "availableCommands": ["moveForward", "turnLeft", "turnRight", "repeat", "pickup"],
  "maxCommands": 5,
  "hint": "Met repeat kun je een commando meerdere keren herhalen. Probeer: repeat(5, moveForward) met pickup ertussen.",
  "solution": ["pickup", "moveForward", "pickup", "moveForward", "moveForward"]
}
